active,location_id,location_name,location_name_fr,operated_by,operated_by_fr,city,address,address_fr,postal_code,province,latitude,longitude,phu_id,phu,phu_fr,phone,website,monday,tuesday,wednesday,thursday,friday,saturday,sunday,after_hours,appointments,walk_ins,drive_through,children_under_2,accessible,temporarily_closed,pharmacy,community_lab,assessment_centre,email,online_appointments,phone_appointments,symptomatic,general_population,age_threshold,weeks_pregnant,french_language_services,asl_interpretation,first_nations,free_parking,paid_parking,public_transit,additional_information,additional_information_fr
Yes,1,Blanche River Health-Kirkland,,Blanche River Health (Kirkland Lake site),,Kirkland Lake,145 Government Road East,145 chemin Government Est,P2N 3P4,ON,48.153552,-80.014725,1,Timiskaming Health Unit,Services de santé du Timiskaming,705-568-2127,http://www.blancheriverhealth.ca/brh_website/,09:00-13:00,09:00-13:00,09:00-13:00,09:00-13:00,09:00-13:00,,,Yes,Yes,No,Yes,,Yes,,,,Yes,,,Yes,Yes,,,,,,,,,,"Please call to schedule an appointment. After hours, please call the hospital in advance for instructions. No walk-ins at the Emergency Department please.",
Yes,2,South Georgian Bay Regional Assessment Centre,,Georgian Bay Family Health Team,,Collingwood,490 Ontario Street,,L9Y 1N6,ON,44.503928,-80.201516,2,Simcoe Muskoka District Health Unit,Bureau de santé publique du district de Simcoe-Muskoka,705-444-5885,https://gbfht.ca/cac/,09:00-17:00,09:00-17:00,09:00-17:00,09:00-17:00,09:00-17:00,closed,closed,,Yes,No,Yes,Yes,Yes,,,,Yes,,https://gbfht.ca/cac/,Yes,Yes,,0m,,No,No,,No,Yes,Yes,"Located in the back parking lot Royal Canadian Legion, so please use the Erie Street entrance, NOT the Ontario Street Entrance. There is no parking fee.  Please use the wait list app on www.gbfht.ca/cac or call to schedule an appointment","Situé dans la tente dans le stationnement de l’Équipe de Santé Familiale, à côté de l’hôpital."
Yes,3,Midland Assessment Centre,Midland Assessment Centre,Georgian Bay General Hospital,Hôpital général de la baie Georgienne,Midland,1156 St. Andrews Drive,,L4R 4P4,ON,44.74184,-79.912455,2,Simcoe Muskoka District Health Unit,Bureau de santé publique du district de Simcoe-Muskoka,705-529-1025,http://gbgh.on.ca/covid-19-novel-coronavirus-updates/,08:00-18:00,08:00-18:00,08:00-18:00,08:00-18:00,08:00-18:00,,,,Yes,No,No,Yes,Yes,,,,Yes,,,,Yes,,0m,,Yes,No,,Yes,,Yes,Please call to schedule an appointment after completing the self-assessment tool on the hospital's website. Appointments for swabbing can be booked via phone by calling 705-529-1025 Monday to Friday 08:00 am to 6:00 pm.  Follow signs/directional signs to the entrance. Clients will see a greeter at the door when they pull up into the parking lot,
Yes,4,Milton District Hospital,Hôpital du district de Milton,Halton Healthcare Services,Halton Healthcare Services,Milton,725 Bronte Street South,725 rue Bronte Sud,L9T 9K1,ON,43.497418,-79.868476,3,Halton Region Health Department,Service de santé de la région d'Halton,905-203-7963,https://www.haltonhealthcare.on.ca/,08:00-17:00,08:00-17:00,08:00-17:00,08:00-17:00,08:00-17:00,08:00-17:00,08:00-17:00,,Yes,No,No,Yes,Yes,,,,Yes,,https://www.haltonhealthcare.on.ca/covid-19-info/booking-a-test,Yes,Yes,,0m,,No,No,,Yes,,Yes,Arrive at scheduled time (no more than 5 minutes early) to the Outpatient Entrance of Milton District Hospital. This is the entrance facing Bronte Street and is marked with yellow flags. Further specific details are provided when appointment is booked.,
Yes,5,Oakville Trafalgar Memorial Hospital,Oakville Trafalger Memorial Hospital,Halton Healthcare Services,Halton Healthcare Services,Oakville,3001 Hospital Gate,3001 Hospital Gate,L6M 0L8,ON,43.450869,-79.763927,3,Halton Region Health Department,Service de santé de la région d'Halton,905-203-7963,https://www.haltonhealthcare.on.ca/,08:00-20:00,08:00-20:00,08:00-20:00,08:00-20:00,08:00-20:00,08:00-20:00,08:00-20:00,,Yes,No,No,Yes,Yes,,,,Yes,,https://www.haltonhealthcare.on.ca/covid-19-info/booking-a-test,Yes,Yes,,0m,,No,No,,Yes,,Yes,Please call to schedule an appointment. Arrive at scheduled time (no more than 5 minutes early) to the South Entrance of Oakville Trafalgar Memorial Hospital. This is the entrance facing Dundas Street and is marked with multi-coloured flags. Do not enter via the Emergency Department. Further specific details are provided when appointment is booked.,
Yes,6,Georgetown Hospital,Hôpital de Georgetown,Halton Healthcare Services,Halton Healthcare Services,Georgetown,1 Princess Anne Drive,1 chemin Princess Anne,L7G 2B8,ON,43.644985,-79.933321,3,Halton Region Health Department,Service de santé de la région d'Halton,905-203-7963,https://www.haltonhealthcare.on.ca/,,,08:00-16:00,,,08:00-16:00,08:00-16:00,,Yes,No,No,Yes,Yes,,,,Yes,,https://www.haltonhealthcare.on.ca/covid-19-info/booking-a-test,Yes,Yes,,0m,,No,No,,Yes,,Yes,The Testing Centre is located in the trailer behind the hospital. Arrive at scheduled time (no more than 5 minutes early) to the mobile testing centre located at rear of Georgetown Hospital. Further specific details are provided when appointment is booked.,
Yes,7,Headwaters Health Care Centre,Headwaters Health Care Centre,Headwaters Health Care Centre,Headwaters Health Care Centre,Orangeville,100 Rolling Hills Drive,100 chemin Rolling Hills,L9W 4X9,ON,43.920776,-80.072523,4,Wellington-Dufferin-Guelph Health Unit,Bureau de santé publique de Wellington-Dufferin-Guelph,833-442-2001,https://www.headwatershealth.ca/,10:00-22:00,10:00-22:00,10:00-22:00,10:00-22:00,10:00-22:00,10:00-22:00,10:00-22:00,,Yes,No,No,No,No,,,,Yes,,,Yes,Yes,,2y,,No,No,,,Yes,Yes,"Please call 1-833-442-2001 between the hours of 8:30 am and 4:30 pm daily to book an appointment.  Located beside the Emergency Department.  Last patient is seen at 9:40 pm.  For children under 2 years of age and requiring COVID-19 testing, please visit the Emergency Department. 

Appointment and location details: Appointment only.  Call or go online at www.headwatershealth.ca to book an appointment.  No drive through available.  Near public transit.",
Yes,8,MacKenzie Health,MacKenzie Health,MacKenzie Health,MacKenzie Health,Richmond Hill,10 Trench Street,10 rue Trench,L4C 4Z3,ON,43.870017,-79.450278,5,York Region Public Health Services,Service de santé de la région de York,905-883-1212 ext. 2004,https://www.mackenziehealth.ca/en/index.aspx,10:00-21:30,10:00-21:30,10:00-21:30,10:00-21:30,10:00-21:30,10:00-17:30,10:00-17:30,,Yes,No,No,Yes,,,,,Yes,,,,Yes,,6m,20,,,,,,,Please call to schedule an appointment after completing the self-assessment tool on the Mackenzie Health website.,
Yes,9,Markham Stouffville Hospital,Hôpital de Markham-Stouffville,Markham Stouffville Hospital,Hôpital de Markham-Stouffville,Markham,381 Church Street,381 rue Church,L3P 7P3,ON,43.884138,-79.231961,5,York Region Public Health Services,Service de santé de la région de York,,https://www.msh.on.ca/,09:00-19:00,09:00-19:00,09:00-19:00,09:00-19:00,09:00-19:00,09:00-17:00,09:00-17:00,,Yes,No,No,Yes,Yes,,,,Yes,,https://www.msh.on.ca/clinics-departments/covid-19-assessment-centre#registration,,Yes,,0m,,No,No,,,Yes,Yes,"To get tested at Markham Stouffville Hospital’s COVID-19 Assessment Centre you must meet current OH guidance for screening and REGISTER online to book an appointment at https://www.msh.on.ca/clinics-departments/covid-19-assessment-centre#registration
 We do swab all ages at our assessment center.",
,10,Bracebridge Rotary Centre,Bracebridge Rotary Centre,Muskoka Algonquin Healthcare,Muskoka Algonquin Healthcare,Bracebridge,131 Wellington Street,131 rue Wellington,P1L 1E2,ON,45.037419,-79.318023,2,Simcoe Muskoka District Health Unit,Bureau de santé publique du district de Simcoe-Muskoka,888-383-7009,https://www.mahc.ca/en/services/covid19.aspx#,09:00-17:00,09:00-17:00,09:00-17:00,09:00-17:00,09:00-17:00,closed,closed,,Yes,No,Yes,Yes,Yes,Yes,,,Yes,,,,Yes,Yes,0m,,No,No,,Yes,,No,,
,11,Huntsville District Memorial Hospital,Hôpital Memorial du district de Huntsville,Muskoka Algonquin Healthcare,Muskoka Algonquin Healthcare,Huntsville,100 Frank Miller Drive,100 chemin Frank Miller,P1H 1H7,ON,45.339214,-79.20568,2,Simcoe Muskoka District Health Unit,Bureau de santé publique du district de Simcoe-Muskoka,888-383-7009,https://www.mahc.ca/en/services/covid19.aspx#,09:00-17:00,09:00-17:00,09:00-17:00,09:00-17:00,09:00-17:00,closed,closed,,Yes,No,Yes,Yes,Yes,Yes,,,Yes,,,,Yes,Yes,0m,,No,No,,Yes,,No,,
Yes,12,Orillia Soldiers' Memorial Hospital,Hôpital Soldiers' Memorial d'Orillial,Orillia Soldiers' Memorial Hospital,Hôpital Soldiers' Memorial d'Orillial,Orillia,100 University Avenue,,L3H 6H2,ON,44.589157,-79.455401,2,Simcoe Muskoka District Health Unit,Bureau de santé publique du district de Simcoe-Muskoka,888-589-4109,https://www.osmh.on.ca/,11:00-18:30,11:00-18:30,11:00-18:30,11:00-18:30,11:00-18:30,11:00-14:30,11:00-14:30,,Yes,No,No,Yes,Yes,,,,Yes,,https://outlook.office365.com/owa/calendar/COVIDAssessment@osmh.on.ca/bookings/,,Yes,Yes,0m,,No,No,,Yes,,Yes,"Appointments can also be booked by calling 1-888-589-4109 from 8 am to 4 pm.

https://www.osmh.on.ca/covid-19/

Do not enter Rotary Place at the main entrance. Follow the signs and access the Assessment Centre through the dedicated entrance at the side of the building.  Please follow the directions for exiting the building.",
Yes,13,Barrie Community Health Centre,Barrie Community Health Centre,Barrie Community Health Centre,Barrie Community Health Centre,Barrie,490 Huronia Road,490 chemin Huronia,L4N 6M2,ON,44.34716,-79.665693,2,Simcoe Muskoka District Health Unit,Bureau de santé publique du district de Simcoe-Muskoka,,https://www.bchc.ca/,08:30-16:30,08:30-16:30,08:30-16:30,08:30-16:30,08:30-16:30,,,,Yes,No,No,Yes,Yes,,,,Yes,,https://v2.waitwhile.com/book/barriecovidtesting,,Yes,,0m,,No,No,,Yes,,Yes,"Located in the rear building behind the Huronia Urgent Care Clinic.
https://v2.waitwhile.com/book/barriecovidtesting",
Yes,14,Southlake Regional Health Centre,Southlake Regional Health Centre,Southlake Regional Health Centre,Southlake Regional Health Centre,Newmarket,474 Davis Drive,474 chemin Davis,L3Y 2P3,ON,44.05929,-79.458347,5,York Region Public Health Services,Service de santé de la région de York,289-803-2199,https://southlake.ca/,08:00-21:00,08:00-21:00,08:00-21:00,08:00-21:00,08:00-21:00,08:00-21:00,08:00-21:00,,Yes,Yes,No,Yes,Yes,,,,Yes,,,Yes,Yes,,0m,,Yes,Yes,,,Yes,Yes,The assessment centre is located in the Town of Newmarket’s Seniors’ Meeting place. Park at the rear of the building follow signs to entrance.  Call 289-803-2199 to book an appointment.,
Yes,15,Stevenson Memorial Hospital,Hôpital Stevenson Memorial,Stevenson Memorial Hospital,Hôpital Stevenson Memorial,Alliston,200 Fletcher Crescent,200 Fletcher Crescent,L9R 1W7,ON,44.155578,-79.875078,2,Simcoe Muskoka District Health Unit,Bureau de santé publique du district de Simcoe-Muskoka,249-501-0383,http://www.stevensonhospital.ca/,09:00-17:00,,09:00-17:00,09:00-17:00,09:00-17:00,closed,closed,,Yes,No,Yes,No,Yes,,,,Yes,,,,Yes,,2y,,No,No,,,Yes,No,"Please call 249-501-0383 to book an appointment. 
Drive-through centre located in the back parking lot.",
Yes,16,COVID-19 Trillium Health Partners - Mississauga Site,,Trillium Health Partners,Trillium Health Partners,Mississauga,15 Bronte College Court,15 Bronte College Court,L5B 1M9,ON,43.572542,-79.60644,6,Peel Public Health,Bureau de santé de la région de Peel,,https://trilliumhealthpartners.ca/covid-19/A/assessment.html#starthere,,10:00-18:00,10:00-18:00,10:00-18:00,10:00-18:00,10:00-18:00,,,Yes,No,No,Yes,Yes,,,,Yes,,https://trilliumhealthpartners.ca/covid-19/A/assessment.html#starthere,,Yes,,1y,,No,No,,Yes,,Yes,,
Yes,17,Credit Valley Hospital – Drive-Thru,Hôpital Credit Valley - Drive-Thru,Trillium Health Partners,Trillium Health Partners,Mississauga,2200 Eglinton Avenue West,2200 chemin Eglinton Ouest,L5M 2N1,ON,43.558655,-79.703279,6,Peel Public Health,Bureau de santé de la région de Peel,,https://trilliumhealthpartners.ca/covid-19/A/assessment.html#starthere,10:00-18:00,10:00-18:00,10:00-18:00,10:00-18:00,10:00-18:00,10:00-18:00,10:00-18:00,,Yes,No,Yes,Yes,Yes,,,,Yes,,http://trilliumhealthpartners.ca/covid-19/A/assessment.html#starthere,,Yes,,1y,,Yes,No,,Yes,,Yes,"Appointments can be booked through the website. 
https://trilliumhealthpartners.ca/covid-19/A/assessment.html#starthere
Can test anyone over 1 years old.",
No,18,COVID-19 Trillium Health Partners - Mississauga S,Credit Valley Hospital – Valley House,Trillium Health Partners,Trillium Health Partners,Mississauga,2200 Eglinton Avenue West,2200 chemin Eglinton Ouest,L5M 2N1,ON,43.558655,-79.703279,6,Peel Public Health,Bureau de santé de la région de Peel,,https://trilliumhealthpartners.ca/covid-19/A/assessment.html#starthere,,10:00-18:00,10:00-18:00,10:00-18:00,10:00-18:00,10:00-18:00,,,Yes,No,No,,No,,,,Yes,,https://trilliumhealthpartners.ca/assessment,,Yes,,,,Yes,No,,Yes,,Yes,"Book an appointment online at www.williamoslerhs.ca/coronavirus or Call this number for booking 905-487-1249, 08:00 am to 6:00 pm, 7 days a week.",
Yes,19,William Osler Health System - Etobicoke COVID 19 Testing Centre,,William Osler Health System,William Osler Health System,Etobicoke,101 Humber College Boulevard,,M9V 1R8,ON,43.7290011442219,-79.5975717822123,6,Toronto Public Health,Bureau de santé de Toronto,905-487-1249,https://www.williamoslerhs.ca/coronavirus,08:00-19:00,08:00-19:00,08:00-19:00,08:00-19:00,08:00-19:00,08:00-19:00,08:00-19:00,,Yes,No,No,No,Yes,,,,Yes,,https://www.williamoslerhs.ca/en/visiting-us/covid-19-appointment-booking.aspx,,Yes,,2y,,No,No,,Yes,,Yes,"Book appointments online at www.williamoslerhs.ca/coronavirus or call 905-487-1249 during 08:00 am to 6:00 pm,
 7 days a week.",
Yes,20,William Osler Health System - Brampton COVID 19 Testing Centre,,William Osler Health System,William Osler Health System,Brampton,20 Lynch Street,,L6W 2Z8,ON,43.6527930791216,-79.7359565079387,6,Peel Public Health,Bureau de santé de la région de Peel,905-487-1249,https://www.williamoslerhs.ca/coronavirus,14:00-21:00,14:00-21:00,14:00-21:00,14:00-21:00,14:00-21:00,14:00-21:00,14:00-21:00,,Yes,No,No,No,Yes,,,,Yes,,https://www.williamoslerhs.ca/en/visiting-us/covid-19-appointment-booking.aspx,,Yes,,2y,,No,No,,Yes,,Yes,"Book appointments online at www.williamoslerhs.ca/coronavirus or call 905-487-1249,  7 days a week.",
Yes,21,Almonte General Hospital,Hôpital général d'Almonte,Almonte General Hospital,Hôpital général d'Almonte,Almonte,75 Spring Street,,K0A 1A0,ON,45.228961,-76.189452,7,"Leeds, Grenville and Lanark District Health Unit",Bureau de santé du district de Leeds,613-325-1208,http://www.almontegeneral.com/assessmentcentre,10:00-18:00,10:00-18:00,10:00-18:00,10:00-18:00,10:00-18:00,10:00-18:00,10:00-18:00,,Yes,No,Yes,No,Yes,,,,Yes,,,,Yes,,2y,,No,No,,Yes,,No,"Located at the corner of Spring Street and State Street in the brick building behind Almonte General Hospital's Emergency Department.



Please call to schedule an appointment and leave a message if needed. One of the clinic nurses will call back with an appointment time. Parking is available at the Centre.&nbsp;",
Yes,22,Brockville General Hospital,Hôpital général de Brockville,Brockville General Hospital,Hôpital général de Brockville,Brockville,100 Magedoma Boulevard,100 boul. Magedoma,K6V 7J5,ON,44.610024,-75.699937,7,"Leeds, Grenville and Lanark District Health Unit",Bureau de santé du district de Leeds,613-704-1441,https://www.brockvillegeneralhospital.ca/en/patient-care/covid-19-coronavirus.aspx#,10:00-17:30,10:00-17:30,10:00-17:30,10:00-17:30,10:00-17:30,10:00-14:30,10:00-14:30,,Yes,Yes,No,Yes,Yes,,,,Yes,,,,Yes,,1y,,No,No,,Yes,,,,
Yes,23,"COVID-19 CHEO Assessment Centre for Infants, Children and Youth at Brewer Park Arena",,CHEO,CHEO,Ottawa,151 Brewer Way,151 chemin Brewer Way,K1S 5T1,ON,45.389239,-75.690478,8,Ottawa Public Health,Bureau de santé publique d'Ottawa,613-737-7600 ext. 6720,https://www.ottawapublichealth.ca/en/shared-content/assessment-centres.aspx,10:30-17:30,10:30-17:30,10:30-17:30,10:30-17:30,10:30-17:30,08:30-15:30,08:30-15:30,,Yes,Yes,No,Yes,Yes,,,,Yes,,https://www.ottawapublichealth.ca/en/shared-content/assessment-centres.aspx#Click-here-to-learn-more-and-book-an-appointment,Yes,Yes,,6m,,Yes,No,,Yes,,Yes,"PEDIATRIC
Appointment only. Please visit the website to make an appointment. 
For those requiring extra support for accessibility reasons, please contact CHEO’s Patient Experience team at 613-737-7600, ext. 6720.

Can test anyone 2months to 18 years of age by appointment. 
Follow the signage for parking. Enter from Bronson Avenue.
Free parking available
Near public transit
French-language services available
Accommodates wheelchairs and mobility devices",
Yes,24,COVID-19 Assessment Centre for Adults at Brewer Park Arena,,The Ottawa Hospital,L'Hôpital d'Ottawa,Ottawa,151 Brewer Way,151 chemin Brewer Way,K1S 5T1,ON,45.389239,-75.690478,8,Ottawa Public Health,Bureau de santé publique d'Ottawa,613-737-8193,https://www.ottawapublichealth.ca/en/shared-content/assessment-centres.aspx,10:30-17:30,10:30-17:30,10:30-17:30,10:30-17:30,10:30-17:30,08:30-15:30,08:30-15:30,,Yes,Yes,No,No,Yes,,,,Yes,,https://www.ottawapublichealth.ca/en/shared-content/assessment-centres.aspx#Click-here-to-learn-more-and-book-an-appointment,Yes,Yes,,18y,,Yes,No,,Yes,,Yes,"Follow the signage for parking. Enter from Bronson Avenue.
18 years and older: by appointment
Free parking available
Near public transit
French-language services available
Accommodates wheelchairs and mobility devices",
Yes,25,Cornwall COVID-19 Assessment Centre,Cornwall - Centre d’évaluation pour la COVID-19,Cornwall Community Hospital,Hôpital communautaire de Cornwall,Cornwall,850 McConnell Avenue,850 avenue McConnell,K6H 4M3,ON,45.030101,-74.717964,9,Eastern Ontario Health Unit,Bureau de santé de l'est de l'Ontario,343-475-0160,https://eohu.ca/en/covid/covid-19-testing-assessment-centres,08:00-20:00,08:00-16:00,08:00-16:00,08:00-20:00,08:00-16:00,08:00-16:00,,,Yes,No,No,Yes,Yes,,,,Yes,,https://eohu.ca/en/covid/covid-19-testing-assessment-centres,,Yes,,0m,,Yes,No,,Yes,,Yes,Park in a designated area in the Emergency Lot: Parking is free. Arrive at the exact time of your appointment (not earlier). Please wait outside and someone will greet you at the door. Bring only a health card and mask.,
Yes,26,Akausivik Inuit Family Health Team - COVID-19 Assessment Centre,Akausivik Inuit Family Health Team -Centre d'èvaluation de la COVID-19,Akausivik Inuit Family Health Team,Akausivik Inuit Family Health Team,Ottawa,"24 Selkirk Street, Suite 300",24 rue Selkirk,K1L 0A4,ON,45.431716,-75.667688,8,Ottawa Public Health,Bureau de santé publique d'Ottawa,613-740-0999,https://www.ottawapublichealth.ca/en/public-health-topics/resources/AIFHT-COVID-Testing-Info--Video---English.pdf,10:30-18:00,10:30-18:00,10:30-18:00,10:30-18:00,10:30-18:00,closed,closed,,Yes,No,No,Yes,,,,,Yes,generalinfo@aifht.ca,,,Yes,,0m,,,,Yes,,,,Please call to schedule an appointment. Services offered in Inuktitut and English.,
Yes,27,Haliburton County Assessment Centre,,Haliburton Highlands Health Services,Haliburton Highlands Health Services,Haliburton,7217 Gelert Road,7217 chemin Gelert,K0M 1S0,ON,45.039054,-78.528165,10,"Haliburton, Kawartha, Pine Ridge District Health Unit",Bureau de santé du district d'Haliburton-Kawartha-Pine Ridge,705-457-1212 ext. 6,https://www.haliburtoncares.ca/,09:00-16:00,09:00-16:00,09:00-16:00,09:00-16:00,09:00-15:00,closed,closed,,Yes,No,No,No,Yes,,,,Yes,,,,Yes,,2y,,No,No,,Yes,,Yes,"Located in the parking lot of the Haliburton Family Medical Centre. Enter from Haliburton County Road 21, on the roadway beside the high school.
Please call to schedule an appointment after completing the online self-assessment.

Parents of school-aged children:  Please bring your children to the Assessment Centre for testing (not the Emergency Department).  

Patients under 2 years of age will be deferred to the Emergency Department.",
Yes,28,Hawkesbury COVID-19 Assessment Centre,Hawkesbury- Centre d’évaluation pour la COVID-19,Hawkesbury General Hospital,Hawkesbury General Hospital,Hawkesbury,750 Laurier Street,750 rue Laurier,K6A 3N9,ON,45.603834,-74.598607,9,Eastern Ontario Health Unit,Bureau de santé de l'est de l'Ontario,613-446-7677,https://eohu.ca/en/covid/covid-19-testing-assessment-centres,09:00-17:00,09:00-17:00,09:00-17:00,09:00-17:00,09:00-17:00,closed,closed,,Yes,Yes,No,No,Yes,,,,Yes,,https://epicapps.toh.ca/mychart/openscheduling,,Yes,,2y,,Yes,Yes,,Yes,,No,"Vulnerable clients and clients with cancer can get tested before opening times. If you do not have internet access or need assistance with the appointment system, call 613-632-1111, ext. 53800.","Sur rendez-vous seulement

Si vous n’avez pas accès à internet ou que vous avez besoin d’aide avec le système de rendez-vous, composez le 613-632-1111, poste 53800."
Yes,29,Casselman COVID-19 Assessment Centre,Casselman - Centre d’évaluation pour la COVID-19,Hopital General de Hawkesbury and District General Hospital,,Casselman,710 Principale Street,,K0A 1M0,ON,45.3125546595604,-75.0861035742728,9,Eastern Ontario Health Unit,Bureau de santé de l'est de l'Ontario,613-288-5353,https://epicapps.toh.ca/mychart/openscheduling,08:00-16:00,08:00-16:00,08:00-16:00,08:00-16:00,08:00-16:00,,closed,,Yes,Yes,No,Yes,Yes,,,,Yes,,https://epicapps.toh.ca/mychart/openscheduling?lang=canadianenglish,,Yes,,1y,,Yes,No,,Yes,,No,"If you do not have internet access or need assistance with the appointment system, call 613-632-1111, ext. 53800.

Appointment and location details
•	Appointment only. Visit their website to make an appointment",
Yes,30,Hawkesbury and District General Hospital - Rockland,,Clarence-Rockland Family Health Team,Équipe de santé familiale Clarence-Rockland,Rockland,2741 Chamberland Street,2741 Chemin Chamberland,K4K 0B4,ON,45.544511,-75.301242,9,Eastern Ontario Health Unit,Bureau de santé de l'est de l'Ontario,613-446-7677,https://eohu.ca/en/covid/covid-19-testing-assessment-centres,08:00-20:00,08:00-20:00,08:00-20:00,08:00-20:00,08:00-16:00,,closed,,Yes,No,No,No,,,,,Yes,,https://eohu.ca/en/covid/covid-19-testing-assessment-centres,,Yes,,,,Yes,,,,,,"Testing available for all age groups

Website: https://www.crfht.ca/en/our-clinic/covid-19-updates",
Yes,31,COVID-19 Care and Testing Centre – Heron,Hôpital Montfort - Heron Location,Hôpital Montfort,Hôpital Montfort,Ottawa,1485 Heron Road,1485 chemin Heron,K1V 6A6,ON,45.38042,-75.654826,8,Ottawa Public Health,Bureau de santé publique d'Ottawa,613-746-4621,https://hopitalmontfort.com/en/heron-and-ray-friel-covid-19-care-clinics-offer-online-booking,09:00-15:30,09:00-15:30,09:00-15:30,09:00-15:30,09:00-15:30,,,,Yes,Yes,No,Yes,Yes,,,,Yes,,https://www.ottawapublichealth.ca/en/shared-content/assessment-centres.aspx#Click-here-to-learn-more-and-book-an-appointment,,Yes,,6m,,Yes,No,,Yes,,Yes,"Scheduled to close temporarily on July 2, 2021.",
Yes,32,Kingston Assessment Centre,Kingston Assessment Centre,Kingston Health Sciences Centre,Kingston Health Sciences Centre,Kingston,51 Heakes Lane,,K7M 9B1,ON,44.218676,-76.521757,11,"Kingston, Frontenac and Lennox & Addington Health Unit",Bureau de santé de Kingston,613-548-2376,https://kingstonhsc.ca/patients-families-and-visitors/covid-19-information/community-assessment-centre,09:00-16:00,09:00-16:00,09:00-16:00,09:00-16:00,09:00-16:00,09:00-16:00,09:00-16:00,,Yes,No,No,Yes,Yes,,,,Yes,,https://kingstonhsc.ca/,Yes,Yes,,6m,,Yes,No,,,Yes,Yes,"To book an appointment online - https://kingstonhsc.ca/patients-families-and-visitors/covid-19-information/community-assessment-centre

To book an appointment by telephone please call 613-548-2376 (between 930 a.m. and 3:30 p.m.)

The Beechgrove Complex: Enter by turning south at the King St W and Portsmouth Ave intersection and follow the signage for walk in.",
,33,Lakeridge Health - Oshawa,Lakeridge Health - Oshawa,Lakeridge Health,Lakeridge Health,Oshawa,1 Hospital Court,1 Hospital Court,L1G 2B9,ON,43.905529,-78.869215,12,Durham Region Health Department,Service de santé de la région de Durham,,https://www.lakeridgehealth.on.ca/en/patientsandvisitors/novel-coronavirus-2019-ncov.asp,09:00-20:00,09:00-20:00,09:00-20:00,09:00-20:00,09:00-20:00,,,,Yes,No,No,,Yes,Yes,,,Yes,,http://durhamcovidswab.lh.ca/,,Yes,,0m,,Yes,Yes,,,Yes,Yes,"Please complete the online registration form. Patients will be called or emailed with an appointment time. Yes there is a separate entrance leading into the Hospital, the clinic is located right near that entrance so no other population can access.  Parking is free for the first 30 minutes. We have interpretation services for most languages.  We also have swabbed patients in their cars if it is warranted.",
Yes,34,Lakeridge Health - Ajax Pickering,Lakeridge Health - Ajax Pickering,Lakeridge Health,Lakeridge Health,Ajax,580 Harwood Avenue South,580 avenue Harwood Sud,L1S 2J4,ON,43.836799,-79.017114,12,Durham Region Health Department,Service de santé de la région de Durham,,http://covidswab.lh.ca,08:00-18:00,08:00-18:00,08:00-18:00,08:00-18:00,08:00-18:00,08:00-18:00,08:00-18:00,,Yes,No,No,No,Yes,,,,Yes,,http://covidswab.lh.ca,,Yes,,18y,,No,No,,No,Yes,Yes,Please complete the online registration form. Patients will be called or emailed with an appointment time. Separate building on hospital property.,
